{
  "report_id": "MR-RUN-EXAMPLE-001-1",
  "version": 1,
  "run_id": "RUN-EXAMPLE-001",
  "pass_id": "PASS-1",
  "language": "en",
  "answered_from_sources": {
    "count": 2,
    "items": [
      {
        "question": "Which entities are in the group?",
        "answered_by": {
          "source_id": "SRC-REGISTER",
          "held": "held",
          "version": "1",
          "sha256": "3055341ece39455e1aacd13bdfca2515dbf992d9d4dce6307f627cd995d72c82",
          "location": "[ORG]AIOC-SL output socket @ SLM-0600aba3e5d8a927341ce6fe09ff9257309c0448fb6397fedf689cd05a6c284f",
          "snapshot_id": "SLM-0600aba3e5d8a927341ce6fe09ff9257309c0448fb6397fedf689cd05a6c284f",
          "origin_kind": "document",
          "status": "in force",
          "confidentiality": "internal"
        }
      },
      {
        "question": "What is the organisation for?",
        "answered_by": {
          "source_id": "SRC-ARTICLES",
          "held": "held",
          "version": "1",
          "sha256": "76b809a01069ff7d9f42f0ca33b04dbeb0cfaccc2e53cc62229a1c87e1eede56",
          "location": "[ORG]AIOC-SL output socket @ SLM-0600aba3e5d8a927341ce6fe09ff9257309c0448fb6397fedf689cd05a6c284f",
          "snapshot_id": "SLM-0600aba3e5d8a927341ce6fe09ff9257309c0448fb6397fedf689cd05a6c284f",
          "origin_kind": "document",
          "status": "in force",
          "confidentiality": "internal",
          "anchor": "s2"
        }
      }
    ]
  },
  "open_needs": {
    "documents": [],
    "explainers": [
      {
        "request_id": "NR-EX-0001",
        "blocks": "present state: decision rights",
        "if_unanswered": "decision domains stop at what the articles name"
      }
    ],
    "confirmations": [],
    "statuses": [],
    "exports": [
      {
        "request_id": "NR-EXP-0001",
        "blocks": "entity roster",
        "if_unanswered": "the roster rests on the held register only"
      }
    ],
    "decisions": []
  },
  "carried_without_asking": [
    {
      "item": "office opening hours",
      "carried_as": "assumption",
      "cost": "none: no design decision depends on it"
    }
  ],
  "past_deadline": [],
  "issued_at": "2026-10-15T08:00:00Z"
}
